{
  "run_id": "2026-04-18T19-28-32Z",
  "generated_at": "2026-04-18T19:29:23.699368+00:00",
  "status": "passed",
  "checks": [],
  "scenarios": [
    {
      "name": "happy_path",
      "status": "passed",
      "detail": "{\"initiative_id\": \"initiative-1776540521132-q7j1tzf1\", \"brief_id\": \"brief-1776540521161-gxmh601o\", \"task_graph_id\": \"task-graph-initiative-1776540521132-q7j1tzf1-brief-1776540521161-gxmh601o\", \"batch_ids\": [\"batch-1776540521304-41d75au9\", \"batch-1776540521284-hkna0u2y\", \"batch-1776540521241-hpc266ga\", \"batch-1776540521204-rocl09an\", \"batch-1776540521171-o2710vfu\"], \"delivery_id\": \"delivery-1776540521373-hywh62ng\", \"preview_url\": \"file:///Users/martin/infinity/.local-state/orchestration/deliveries/initiative-1776540521132-q7j1tzf1/delivery-1776540521373-hywh62ng/preview.html\", \"handoff_path\": \"/Users/martin/infinity/.local-state/orchestration/deliveries/initiative-1776540521132-q7j1tzf1/delivery-1776540521373-hywh62ng/HANDOFF.md\", \"result_url\": \"http://127.0.0.1:3101/project-result/initiative-1776540521132-q7j1tzf1?founderos_launch=1&project_id=project-borealis&session_id=session-2026-04-11-002&group_id=group-core-02&account_id=account-chatgpt-02&workspace_id=workspace-borealis-review&opened_from=execution_board&host_origin=http%3A%2F%2F127.0.0.1%3A3738&embedded=1&launch_token=eyJ2IjoxLCJwcm9qZWN0SWQiOiJwcm9qZWN0LWJvcmVhbGlzIiwic2Vzc2lvbklkIjoic2Vzc2lvbi0yMDI2LTA0LTExLTAwMiIsImdyb3VwSWQiOiJncm91cC1jb3JlLTAyIiwiYWNjb3VudElkIjoiYWNjb3VudC1jaGF0Z3B0LTAyIiwid29ya3NwYWNlSWQiOiJ3b3Jrc3BhY2UtYm9yZWFsaXMtcmV2aWV3Iiwib3BlbmVkRnJvbSI6ImV4ZWN1dGlvbl9ib2FyZCIsImlzc3VlZEF0IjoiMjAyNi0wNC0xOFQxOToyODo0My43NDdaIiwiZXhwaXJlc0F0IjoiMjAyNi0wNC0xOFQxOTozMzo0My43NDdaIn0.ife5QkGvITm4JIKzDjxKFNWd4DulrbWP1fS8ZQkNDI0\"}"
    },
    {
      "name": "failure_recovery_path",
      "status": "passed",
      "detail": "{\"initiative_id\": \"initiative-1776540524491-vw1h6c1d\", \"task_graph_id\": \"task-graph-initiative-1776540524491-vw1h6c1d-brief-1776540524499-ftc9en97\", \"delivery_id\": \"delivery-1776540526943-7uxggira\", \"recovered_batches\": [\"batch-1776540526752-3txp45wg\", \"batch-1776540526776-44z5vg61\", \"batch-1776540526810-t60jiw2v\", \"batch-1776540526862-fu2c5zgq\"]}"
    }
  ],
  "artifacts": [
    "route-matrix.json",
    "api-exposure-checklist.json",
    "screenshot-manifest.json",
    "critic-brief.md"
  ]
}
