{
  "run_id": "2026-04-18T14-04-49Z",
  "generated_at": "2026-04-18T14:06:13.097110+00:00",
  "status": "passed",
  "checks": [],
  "scenarios": [
    {
      "name": "happy_path",
      "status": "passed",
      "detail": "{\"initiative_id\": \"initiative-1776521095446-oit4j6l4\", \"brief_id\": \"brief-1776521095464-1jdsomcq\", \"task_graph_id\": \"task-graph-initiative-1776521095446-oit4j6l4\", \"batch_ids\": [\"batch-1776521100358-s2pn4j8t\", \"batch-1776521106706-m0dp1ng3\"], \"delivery_id\": \"delivery-1776521117918-y3e6rd4e \", \"result_url\": \"http://127.0.0.1:3101/project-result/initiative-1776521095446-oit4j6l4?founderos_launch=1&project_id=project-borealis&session_id=session-2026-04-11-002&group_id=group-core-02&account_id=account-chatgpt-02&workspace_id=workspace-borealis-review&opened_from=execution_board&host_origin=http%3A%2F%2F127.0.0.1%3A3737&embedded=1\"}"
    },
    {
      "name": "failure_recovery_path",
      "status": "passed",
      "detail": "{\"initiative_id\": \"initiative-1776521119823-7y25qz0z\", \"recovered_batches\": [\"batch-1776521133120-slkh99ab\", \"batch-1776521139256-2hlsoiw0\"]}"
    }
  ],
  "artifacts": [
    "route-matrix.json",
    "api-exposure-checklist.json",
    "screenshot-manifest.json",
    "critic-brief.md"
  ]
}
