{
  "run_id": "2026-04-18T18-18-43Z",
  "generated_at": "2026-04-18T18:21:09.312707+00:00",
  "status": "passed",
  "checks": [
    {
      "name": "shell_lint",
      "status": "passed",
      "detail": "Command passed in 5.31s. Log: /Users/martin/infinity/handoff-packets/validation/2026-04-18T18-18-43Z/logs/shell_lint.log"
    },
    {
      "name": "shell_typecheck",
      "status": "passed",
      "detail": "Command passed in 2.44s. Log: /Users/martin/infinity/handoff-packets/validation/2026-04-18T18-18-43Z/logs/shell_typecheck.log"
    },
    {
      "name": "shell_test",
      "status": "passed",
      "detail": "Command passed in 1.73s. Log: /Users/martin/infinity/handoff-packets/validation/2026-04-18T18-18-43Z/logs/shell_test.log"
    },
    {
      "name": "work_ui_check",
      "status": "passed",
      "detail": "Command passed in 10.73s. Log: /Users/martin/infinity/handoff-packets/validation/2026-04-18T18-18-43Z/logs/work_ui_check.log"
    },
    {
      "name": "work_ui_test",
      "status": "passed",
      "detail": "Command passed in 1.47s. Log: /Users/martin/infinity/handoff-packets/validation/2026-04-18T18-18-43Z/logs/work_ui_test.log"
    },
    {
      "name": "work_ui_build",
      "status": "passed",
      "detail": "Command passed in 19.24s. Log: /Users/martin/infinity/handoff-packets/validation/2026-04-18T18-18-43Z/logs/work_ui_build.log"
    }
  ],
  "scenarios": [
    {
      "name": "happy_path",
      "status": "passed",
      "detail": "{\"initiative_id\": \"initiative-1776536367730-pb6g292h\", \"brief_id\": \"brief-1776536367742-shpuakvm\", \"task_graph_id\": \"task-graph-initiative-1776536367730-pb6g292h-brief-1776536367742-shpuakvm\", \"batch_ids\": [\"batch-1776536372805-u468i4u5\", \"batch-1776536378921-z9tk1yec\", \"batch-1776536386164-wkkf9zd8\", \"batch-1776536393412-3r5a1v9i\"], \"delivery_id\": \"delivery-1776536402579-mr1qug0z\", \"result_url\": \"http://127.0.0.1:3102/project-result/initiative-1776536367730-pb6g292h?founderos_launch=1&project_id=project-borealis&session_id=session-2026-04-11-002&group_id=group-core-02&account_id=account-chatgpt-02&workspace_id=workspace-borealis-review&opened_from=execution_board&host_origin=http%3A%2F%2F127.0.0.1%3A3738&embedded=1\"}"
    },
    {
      "name": "failure_recovery_path",
      "status": "passed",
      "detail": "{\"initiative_id\": \"initiative-1776536404402-0zpu0vah\", \"recovered_batches\": [\"batch-1776536418743-haf4tv0a\", \"batch-1776536424774-8148cfg6\", \"batch-1776536432016-pdrpeozj\", \"batch-1776536438034-y1oqw8a3\"]}"
    }
  ],
  "artifacts": [
    "route-matrix.json",
    "api-exposure-checklist.json",
    "screenshot-manifest.json",
    "critic-brief.md"
  ]
}
